hatches, Uma das categorias de carros mais procuradas são os hatches. Essa categoria de veículo possui uma separação de 2 volumes.
sedans, Os Sedans, sem dúvida, são uma das categorias de carros preferidas de muitos motoristas. 
SUV, Cada vez mais popular no país, uma das categorias de carros que mais oferecem conforto são os SUVs.
picapes, Essa categoria é caracterizada por uma caçamba da parte traseira, sendo indicado para o uso tanto de passageiros como de cargas. 
conversiveis, Os conversíveis pertencem a uma das categorias de carros mais desejadas por diversos motoristas. 
cupês, Os cupês pertencem às categorias de carros com altura reduzida, 2 portas e carroceria esportiva, porém é possível encontrar alguns modelos de 4 portas.
minivans, As minivans são uma das categorias de carros que também estão entre as preferidas das famílias. 
